{"rules_schema_version":"1.0.0","proposal_version":"0.1.0","status":"proposed","classes":{"pipe.ppr":{"name_ru":"Труба PP-R","family_id":"pressure_pipes","candidate_attributes":["body_material","color","pressure_class","sdr","wall_thickness_mm","length_m"],"candidate_ports":["pipe_end","pipe_end"]},"fitting.ppr":{"name_ru":"Фитинг PP-R","family_id":"pressure_fittings","candidate_attributes":["body_material","color","pressure_class","construction"],"candidate_ports":["connection_1","connection_2"]},"pipe.pex_a":{"name_ru":"Труба PE-Xa","family_id":"pressure_pipes","candidate_attributes":["barrier_layer","color","wall_thickness_mm","coil_length_m"],"candidate_ports":["pipe_end","pipe_end"]},"pipe.pert":{"name_ru":"Труба PE-RT","family_id":"pressure_pipes","candidate_attributes":["barrier_layer","color","wall_thickness_mm","coil_length_m"],"candidate_ports":["pipe_end","pipe_end"]},"pipe.multilayer":{"name_ru":"Многослойная труба","family_id":"pressure_pipes","candidate_attributes":["layer_structure","wall_thickness_mm","coil_length_m"],"candidate_ports":["pipe_end","pipe_end"]},"pipe.hdpe":{"name_ru":"Труба ПНД","family_id":"pressure_pipes","candidate_attributes":["pe_grade","sdr","pressure_class","wall_thickness_mm","coil_length_m"],"candidate_ports":["pipe_end","pipe_end"]},"fitting.axial":{"name_ru":"Аксиальный фитинг","family_id":"pressure_fittings","candidate_attributes":["body_material","construction"],"candidate_ports":["axial_1","axial_or_thread_2"]},"fitting.radial":{"name_ru":"Радиальный пресс-фитинг","family_id":"pressure_fittings","candidate_attributes":["body_material","profile"],"candidate_ports":["press_1","press_or_thread_2"]},"fitting.compression":{"name_ru":"Компрессионный фитинг","family_id":"pressure_fittings","candidate_attributes":["body_material","construction"],"candidate_ports":["compression_1","compression_or_thread_2"]},"pipe.sewer.internal":{"name_ru":"Труба внутренней канализации","family_id":"sewer_pipes","candidate_attributes":["body_material","color","length_mm"],"candidate_ports":["socket","spigot"]},"fitting.sewer.internal":{"name_ru":"Фитинг внутренней канализации","family_id":"sewer_fittings","candidate_attributes":["body_material","color","angle_deg"],"candidate_ports":["sewer_port_1","sewer_port_2"]},"pipe.sewer.external":{"name_ru":"Труба наружной канализации","family_id":"sewer_pipes","candidate_attributes":["ring_stiffness","color","length_mm"],"candidate_ports":["socket","spigot"]},"fitting.sewer.external":{"name_ru":"Фитинг наружной канализации","family_id":"sewer_fittings","candidate_attributes":["ring_stiffness","color","angle_deg"],"candidate_ports":["sewer_port_1","sewer_port_2"]},"pipe.sewer.low_noise":{"name_ru":"Малошумная канализационная труба","family_id":"sewer_pipes","candidate_attributes":["sound_class","color","length_mm"],"candidate_ports":["socket","spigot"]},"fitting.sewer.low_noise":{"name_ru":"Малошумный канализационный фитинг","family_id":"sewer_fittings","candidate_attributes":["sound_class","color","angle_deg"],"candidate_ports":["sewer_port_1","sewer_port_2"]},"fitting.brass.threaded":{"name_ru":"Резьбовой латунный фитинг","family_id":"threaded_fittings","candidate_attributes":["body_material","coating","construction"],"candidate_ports":["thread_1","thread_2"]},"valve.ball":{"name_ru":"Кран шаровой","family_id":"valves","candidate_attributes":["body_material","coating","pressure_class","handle_type"],"candidate_ports":["thread_1","thread_2"]},"valve.shutoff":{"name_ru":"Запорная и регулирующая арматура","family_id":"valves","candidate_attributes":["valve_kind","body_material","control_type"],"candidate_ports":["connection_1","connection_2"]},"manifold":{"name_ru":"Коллектор и коллекторная группа","family_id":"manifolds","candidate_attributes":["outlet_count","control_equipment"],"candidate_ports":["main_inlet","main_outlet","branches"]},"drain.floor":{"name_ru":"Сливной трап","family_id":"drainage","candidate_attributes":["outlet_orientation","seal_type","adjustable","grate_material"],"candidate_ports":["sewer_outlet"]},"support.pipe":{"name_ru":"Крепление и опора для труб","family_id":"mounting_accessories","candidate_attributes":["support_kind","material","diameter_mm"],"candidate_ports":[]},"tool.mounting":{"name_ru":"Инструмент для монтажа труб","family_id":"tools","candidate_attributes":["tool_kind","drive_type","supported_diameters"],"candidate_ports":[]},"accessory.floor_heating":{"name_ru":"Комплектующее теплого пола","family_id":"floor_heating","candidate_attributes":["accessory_kind","material","dimensions"],"candidate_ports":[]},"insulation.pipe":{"name_ru":"Теплоизоляция для труб","family_id":"insulation","candidate_attributes":["inner_diameter_mm","thickness_mm","length_m"],"candidate_ports":[]},"conduit.corrugated":{"name_ru":"Защитная гофрированная оболочка","family_id":"protection","candidate_attributes":["inner_diameter_mm","color","coil_length_m"],"candidate_ports":[]},"sealant.plumbing":{"name_ru":"Герметизирующий материал для сантехники","family_id":"consumables","candidate_attributes":["sealant_kind","strength","viscosity","volume_ml"],"candidate_ports":[]},"sanitary.connector":{"name_ru":"Санитарный соединитель и сифон","family_id":"sanitary_drainage","candidate_attributes":["connector_kind","material","outlet_diameter_mm"],"candidate_ports":["fixture_port","sewer_port"]}},"rules":[{"rule_id":"ctx-fitting-ppr","class_id":"fitting.ppr","priority":10,"exact_context":["Фитинги ППР белые","Фитинги ППР серые","Фитинги ППР зеленые"],"rationale":"source price group"},{"rule_id":"ctx-pipe-ppr","class_id":"pipe.ppr","priority":10,"exact_context":["Трубы ППР белые","Трубы ППР серые","Трубы ППР зеленые"],"rationale":"source price group"},{"rule_id":"ctx-brass-fitting","class_id":"fitting.brass.threaded","priority":10,"exact_context":["Фитинги латунные"],"rationale":"source price group"},{"rule_id":"ctx-axial","class_id":"fitting.axial","priority":10,"exact_context":["Аксиальные фитинги"],"rationale":"source price group"},{"rule_id":"ctx-compression","class_id":"fitting.compression","priority":10,"exact_context":["Фитинги КМПРС"],"rationale":"source price group"},{"rule_id":"ctx-sewer-internal-fitting","class_id":"fitting.sewer.internal","priority":10,"exact_context":["Фитинги ВК","Фитинги ВК BAREON"],"rationale":"source price group"},{"rule_id":"ctx-shutoff","class_id":"valve.shutoff","priority":10,"exact_context":["Запорная арматура","ARROWHEAD"],"rationale":"source price group"},{"rule_id":"ctx-radial","class_id":"fitting.radial","priority":10,"exact_context":["Радиальные фитинги"],"rationale":"source price group"},{"rule_id":"ctx-low-noise-fitting","class_id":"fitting.sewer.low_noise","priority":10,"exact_context":["Фитинги МК"],"rationale":"source price group"},{"rule_id":"ctx-sewer-internal-pipe","class_id":"pipe.sewer.internal","priority":10,"exact_context":["Трубы ВК РТП","Трубы ВК Пиарком","Трубы ВК BAIKAL"],"rationale":"source price group"},{"rule_id":"ctx-pex-pipe","class_id":"pipe.pex_a","priority":10,"exact_context":["Трубы PEX-a SDR 7,4 в изоляции","Трубы PEX-a SDR 7,4","Трубы PEX-a SDR 7,4 без EVOH в изоляции","Трубы PEX-a SDR 7.4 в горфоизоляции","Трубы PEX-a SDR 7,4 без EVOH","Трубы Pex-A","Трубы Pex-A в изоляции"],"rationale":"source price group"},{"rule_id":"ctx-tool-rotorica","class_id":"tool.mounting","priority":10,"exact_context":["ROTORICA","Инструменты для монтажа труб PPR (ножницы, насос)","Инструмент для монтажа труб PE,PP, систем канал.","Инструменты аксиальной системы","Инструменты для радиальной системы","Инструменты для т/пола"],"rationale":"source price group"},{"rule_id":"ctx-sanfix","class_id":"sealant.plumbing","priority":10,"exact_context":["SANFIX"],"rationale":"source product family"},{"rule_id":"ctx-sewer-external-fitting","class_id":"fitting.sewer.external","priority":10,"exact_context":["Фитинги НК"],"rationale":"source price group"},{"rule_id":"ctx-low-noise-pipe","class_id":"pipe.sewer.low_noise","priority":10,"exact_context":["Трубы МК"],"rationale":"source price group"},{"rule_id":"ctx-hdpe-pipe","class_id":"pipe.hdpe","priority":10,"exact_context":["Трубы ПНД РТП"],"rationale":"source price group"},{"rule_id":"ctx-sewer-external-pipe","class_id":"pipe.sewer.external","priority":10,"exact_context":["Трубы НК РТП","Трубы НК Пиарком"],"rationale":"source price group"},{"rule_id":"ctx-manifold","class_id":"manifold","priority":10,"exact_context":["Коллекторы и комплектующие"],"rationale":"source price group"},{"rule_id":"ctx-insulation","class_id":"insulation.pipe","priority":10,"exact_context":["ENERGOFLEX"],"rationale":"source price group"},{"rule_id":"ctx-pert","class_id":"pipe.pert","priority":10,"exact_context":["Трубы PERT"],"rationale":"source price group"},{"rule_id":"ctx-floor-drain","class_id":"drain.floor","priority":10,"exact_context":["Трапы","Трапы АНИпласт"],"rationale":"source price group"},{"rule_id":"ctx-mounting-accessory","class_id":"support.pipe","priority":10,"exact_context":["Комплектующие для монтажа труб PE,PP,систем канал.","Комплектующие для монтажа труб PPR","Хомуты металл"],"rationale":"source price group"},{"rule_id":"ctx-floor-heating","class_id":"accessory.floor_heating","priority":10,"exact_context":["Комплектующие для т/пола"],"rationale":"source price group"},{"rule_id":"ctx-sanitary-ani","class_id":"sanitary.connector","priority":10,"exact_context":["Трубы АНИпласт"],"rationale":"source price group"},{"rule_id":"ctx-corrugated","class_id":"conduit.corrugated","priority":10,"exact_context":["Гофротрубы-оболочки"],"rationale":"source price group"},{"rule_id":"ctx-multilayer","class_id":"pipe.multilayer","priority":10,"exact_context":["Трубы МП Pert/Al/Pert"],"rationale":"source price group"},{"rule_id":"name-ball-valve","class_id":"valve.ball","priority":50,"regex":"^кран\\s+шаровой","rationale":"explicit product name"},{"rule_id":"name-manifold","class_id":"manifold","priority":50,"regex":"^(коллектор|коллекторная группа)","rationale":"explicit product name"},{"r